{
  "schema_version": "1.0",
  "name": "omni-agent-skills",
  "version": "0.0.3",
  "description": "Tool-neutral registry of AI-assisted engineering skills and governance assets",
  "repository": "https://github.com/mrxsierra/omni-agent-skills",
  "license": "MIT",
  "skills": [
    {
      "id": "ai-eval-benchmarker",
      "category": "data-and-ai",
      "summary": "Evaluates AI agent responses, tool invocation schemas, prompt regression suites, and model outputs against reproducible test cases.",
      "path": "registry/skills/data-and-ai/ai-eval-benchmarker/SKILL.md"
    },
    {
      "id": "rag-qa-chunking-engine",
      "category": "data-and-ai",
      "summary": "Transforms documentation, codebases, and technical knowledge bases into structured, high-relevance Q&A pair datasets (llms-qa.json) for semantic search and retrieval.",
      "path": "registry/skills/data-and-ai/rag-qa-chunking-engine/SKILL.md"
    },
    {
      "id": "atomic-feature-implementer",
      "category": "engineering",
      "summary": "Executes minimal, focused code modifications strictly adhering to approved architecture plans, propagating callsite updates and preserving existing behavioral contracts.",
      "path": "registry/skills/engineering/atomic-feature-implementer/SKILL.md"
    },
    {
      "id": "clean-code-auditor",
      "category": "engineering",
      "summary": "Audits git diffs and code modifications for code smells, DRY violations, adherence to repository conventions, and architectural consistency.",
      "path": "registry/skills/engineering/clean-code-auditor/SKILL.md"
    },
    {
      "id": "code-anti-overengineer",
      "category": "engineering",
      "summary": "Simplifies over-engineered code, removes dead abstractions and redundant dependencies, flattens nested conditionals into early returns, and preserves exact behavioral contracts.",
      "path": "registry/skills/engineering/code-anti-overengineer/SKILL.md"
    },
    {
      "id": "pytest-verification-runner",
      "category": "engineering",
      "summary": "Authors and executes unit, integration, and property-based verification test suites using Pytest and unittest to empirically catch regressions and validate invariants.",
      "path": "registry/skills/engineering/pytest-verification-runner/SKILL.md"
    },
    {
      "id": "semver-release-manager",
      "category": "engineering",
      "summary": "Manages Semantic Versioning lifecycle, validates release metadata, updates changelogs, and orchestrates GitHub release workflows.",
      "path": "registry/skills/engineering/semver-release-manager/SKILL.md"
    },
    {
      "id": "system-architecture-planner",
      "category": "engineering",
      "summary": "Analyzes system requirements, evaluates codebase dependencies, formulates architecture specifications, and scopes atomic implementation tasks.",
      "path": "registry/skills/engineering/system-architecture-planner/SKILL.md"
    },
    {
      "id": "advanced-verification-testing",
      "category": "security-and-governance",
      "summary": "Designs, implements, and executes multi-tier verification suites including unit, integration, golden snapshot regression, and property-based invariant testing.",
      "path": "registry/skills/security-and-governance/advanced-verification-testing/SKILL.md"
    },
    {
      "id": "ai-native-product-design",
      "category": "security-and-governance",
      "summary": "Architects software repositories and products for direct AI agent integration, tool exposure via protocols (MCP, OpenAPI), and structured discoverability.",
      "path": "registry/skills/security-and-governance/ai-native-product-design/SKILL.md"
    },
    {
      "id": "oss-launch-governance",
      "category": "security-and-governance",
      "summary": "Manages open-source pre-launch auditing, namespace availability verification, community governance documentation, and release readiness checklists.",
      "path": "registry/skills/security-and-governance/oss-launch-governance/SKILL.md"
    },
    {
      "id": "secret-leak-shield",
      "category": "security-and-governance",
      "summary": "Audits workspace edits and staged files for exposed API keys, private tokens, passwords, and sensitive environment variables to prevent accidental credential commits.",
      "path": "registry/skills/security-and-governance/secret-leak-shield/SKILL.md"
    },
    {
      "id": "tech-competitive-intelligence",
      "category": "security-and-governance",
      "summary": "Conducts objective technical competitive analysis, architectural positioning evaluations, trade-off matrices, and \"Why Not X?\" documentation.",
      "path": "registry/skills/security-and-governance/tech-competitive-intelligence/SKILL.md"
    },
    {
      "id": "a11y-web-auditor",
      "category": "web-and-geo",
      "summary": "Audits web applications for accessibility compliance (WCAG 2.1), responsive layout behavior, semantic markup, and Core Web Vitals performance.",
      "path": "registry/skills/web-and-geo/a11y-web-auditor/SKILL.md"
    },
    {
      "id": "ai-first-web-geo",
      "category": "web-and-geo",
      "summary": "Structures web applications and documentation for Generative Engine Optimization (GEO), RAG search indexing, and machine-readable context discovery.",
      "path": "registry/skills/web-and-geo/ai-first-web-geo/SKILL.md"
    }
  ]
}
